{
    "$schema": "https://json-schema.org/draft/2020-12/schema",
    "$id": "https://baclib.github.io/schemas/type-definition.json",
    "title": "BAClib Type Definition",
    "description": "This schema defines a top-level BAClib data type. Types defined here can be referenced and reused in other schemas.",
    "type": "object",
    "properties": {
        "metadata": {
            "type": "object",
            "description": "Optional metadata about the definition, such as licensing or provenance information."
        },
        "alias": {
            "type": "string",
            "description": "An optional alternative name for the type."
        },
        "name": {
            "$ref": "./type-name.json",
            "description": "The unique name of the type being defined."
        },
        "description": {
            "type": "string",
            "description": "A human-readable description of the type."
        },
        "type": {
            "$ref": "./type-reference.json",
            "description": "A reference to a type, either as a type name or as a set of type traits."
        },
        "primitive": {
            "type": "integer",
            "description": "A primitive type code."
        }
    },
    "required": [
        "name"
    ],
    "oneOf": [
        {
            "required": [
                "type"
            ]
        },
        {
            "required": [
                "primitive"
            ]
        }
    ],
    "additionalProperties": false
}