{
    "metadata": {
        "SPDX-FileCopyrightText": "Copyright 2024-2026 The BAClib Initiative and Contributors",
        "SPDX-License-Identifier": "EPL-2.0"
    },
    "alias": "WriteProperty-Request",
    "name": "write-property-request",
    "description": "Represents a request to write a single property value to a BACnet object, with optional array index and priority.",
    "type": {
        "base": "sequence",
        "fields": [
            {
                "name": "object-identifier",
                "type": "object-identifier",
                "context": 0,
                "description": "The identifier of the BACnet object whose property is to be written."
            },
            {
                "name": "property-identifier",
                "type": "property-identifier",
                "context": 1,
                "description": "The identifier of the property to be written."
            },
            {
                "name": "property-array-index",
                "type": "unsigned",
                "context": 2,
                "optional": true,
                "description": "The index within an array property, if applicable. Optional."
            },
            {
                "name": "property-value",
                "type": "any",
                "context": 3,
                "description": "The value to write to the property."
            },
            {
                "name": "priority",
                "type": {
                    "base": "unsigned",
                    "minimum": 1,
                    "maximum": 16
                },
                "context": 4,
                "optional": true,
                "description": "The priority of the write operation, if applicable. Optional."
            }
        ]
    }
}
