{
    "metadata": {
        "SPDX-FileCopyrightText": "Copyright 2024-2026 The BAClib Initiative and Contributors",
        "SPDX-License-Identifier": "EPL-2.0"
    },
    "alias": "BACnetAuthorizationMode",
    "name": "authorization-mode",
    "description": "Enumerated values indicating the current operational mode of the authorization system.",
    "type": {
        "base": "enumerated",
        "values": [
            {
                "name": "authorize",
                "constant": 0,
                "description": "Authorization mode: authorize."
            },
            {
                "name": "grant-active",
                "constant": 1,
                "description": "Authorization mode: grant active."
            },
            {
                "name": "deny-all",
                "constant": 2,
                "description": "Authorization mode: deny all."
            },
            {
                "name": "verification-required",
                "constant": 3,
                "description": "Authorization mode: verification required."
            },
            {
                "name": "authorization-delayed",
                "constant": 4,
                "description": "Authorization mode: authorization delayed."
            },
            {
                "name": "none",
                "constant": 5,
                "description": "Authorization mode: none."
            }
        ],
        "maximum": 65535,
        "proprietary": {
            "from": 64,
            "to": 65535
        }
    }
}
