{
    "metadata": {
        "SPDX-FileCopyrightText": "Copyright 2024-2026 The BAClib Initiative and Contributors",
        "SPDX-License-Identifier": "EPL-2.0"
    },
    "alias": "ConfirmedPrivateTransfer-Request",
    "name": "confirmed-private-transfer-request",
    "description": "Request parameters for the ConfirmedPrivateTransfer service, used for vendor-specific proprietary services.",
    "type": {
        "base": "sequence",
        "fields": [
            {
                "name": "vendor-id",
                "type": "unsigned-16",
                "context": 0,
                "description": "The vendor identification code."
            },
            {
                "name": "service-number",
                "type": "unsigned",
                "context": 1,
                "description": "The vendor-specific service number."
            },
            {
                "name": "service-parameters",
                "type": "any",
                "context": 2,
                "optional": true,
                "description": "Optional vendor-specific service parameters."
            }
        ]
    }
}
