{
    "metadata": {
        "SPDX-FileCopyrightText": "Copyright 2024-2026 The BAClib Initiative and Contributors",
        "SPDX-License-Identifier": "EPL-2.0"
    },
    "alias": "GetEnrollmentSummary-ACK",
    "name": "get-enrollment-summary-ack",
    "description": "Represents a BACnet GetEnrollmentSummary service acknowledgment, which returns a series of event enrollment summaries matching the request criteria.",
    "type": {
        "base": "sequence",
        "series": true,
        "fields": [
            {
                "name": "object-identifier",
                "type": "object-identifier",
                "description": "The object identifier of the enrolled event-generating object."
            },
            {
                "name": "event-type",
                "type": "event-type",
                "description": "The type of event generated by this object."
            },
            {
                "name": "event-state",
                "type": "event-state",
                "description": "The current event state of the object."
            },
            {
                "name": "priority",
                "type": "unsigned-8",
                "description": "The priority of the event notification."
            },
            {
                "name": "notification-class",
                "type": "unsigned",
                "optional": true,
                "description": "Optional notification class identifier for the event."
            }
        ]
    }
}
