{
    "metadata": {
        "SPDX-FileCopyrightText": "Copyright 2024-2026 The BAClib Initiative and Contributors",
        "SPDX-License-Identifier": "EPL-2.0"
    },
    "alias": "BACnetColorOperationInProgress",
    "name": "color-operation-in-progress",
    "description": "Enumeration indicating the current status of a color operation.",
    "type": {
        "base": "enumerated",
        "values": [
            {
                "name": "idle",
                "constant": 0,
                "description": "No color operation is in progress."
            },
            {
                "name": "fade-active",
                "constant": 1,
                "description": "A fade operation is active."
            },
            {
                "name": "ramp-active",
                "constant": 2,
                "description": "A ramp operation is active."
            },
            {
                "name": "not-controlled",
                "constant": 3,
                "description": "The color operation is not controlled."
            },
            {
                "name": "other",
                "constant": 4,
                "description": "Other color operation in progress."
            }
        ]
    }
}
