{
    "metadata": {
        "SPDX-FileCopyrightText": "Copyright 2024-2026 The BAClib Initiative and Contributors",
        "SPDX-License-Identifier": "EPL-2.0"
    },
    "alias": "BACnetAccessCredentialDisableReason",
    "name": "access-credential-disable-reason",
    "description": "Enumerated values indicating the reason a credential is disabled.",
    "type": {
        "base": "enumerated",
        "values": [
            {
                "name": "disabled",
                "constant": 0,
                "description": "Specifies that the credential is disabled."
            },
            {
                "name": "disabled-needs-provisioning",
                "constant": 1,
                "description": "Specifies that the credential is disabled and needs provisioning."
            },
            {
                "name": "disabled-unassigned",
                "constant": 2,
                "description": "Specifies that the credential is disabled and unassigned."
            },
            {
                "name": "disabled-not-yet-active",
                "constant": 3,
                "description": "Specifies that the credential is disabled and not yet active."
            },
            {
                "name": "disabled-expired",
                "constant": 4,
                "description": "Specifies that the credential is disabled due to expiration."
            },
            {
                "name": "disabled-lockout",
                "constant": 5,
                "description": "Specifies that the credential is disabled due to lockout."
            },
            {
                "name": "disabled-max-days",
                "constant": 6,
                "description": "Specifies that the credential is disabled due to exceeding maximum days."
            },
            {
                "name": "disabled-max-uses",
                "constant": 7,
                "description": "Specifies that the credential is disabled due to exceeding maximum uses."
            },
            {
                "name": "disabled-inactivity",
                "constant": 8,
                "description": "Specifies that the credential is disabled due to inactivity."
            },
            {
                "name": "disabled-manual",
                "constant": 9,
                "description": "Specifies that the credential is disabled manually."
            }
        ],
        "maximum": 65535,
        "proprietary": {
            "from": 64,
            "to": 65535
        }
    }
}
