{
    "metadata": {
        "SPDX-FileCopyrightText": "Copyright 2024-2026 The BAClib Initiative and Contributors",
        "SPDX-License-Identifier": "EPL-2.0"
    },
    "alias": "BACnetDeviceObjectPropertyReference",
    "name": "device-object-property-reference",
    "description": "Represents a reference to a specific property of a BACnet object, optionally including the device and array index for precise identification.",
    "type": {
        "base": "sequence",
        "fields": [
            {
                "name": "object-identifier",
                "type": "object-identifier",
                "context": 0,
                "description": "The identifier of the BACnet object containing the property."
            },
            {
                "name": "property-identifier",
                "type": "property-identifier",
                "context": 1,
                "description": "The identifier of the property within the object."
            },
            {
                "name": "property-array-index",
                "type": "unsigned",
                "context": 2,
                "optional": true,
                "description": "The index within an array property, if applicable. Optional."
            },
            {
                "name": "device-identifier",
                "type": "object-identifier",
                "context": 3,
                "optional": true,
                "description": "The identifier of the BACnet device containing the object, if not local. Optional."
            }
        ]
    }
}
