{
    "metadata": {
        "SPDX-FileCopyrightText": "Copyright 2024-2026 The BAClib Initiative and Contributors",
        "SPDX-License-Identifier": "EPL-2.0"
    },
    "alias": "BACnetPolarity",
    "name": "polarity",
    "description": "Enumerates BACnet polarity states, indicating normal or reverse polarity for binary objects.",
    "type": {
        "base": "enumerated",
        "values": [
            {
                "name": "normal",
                "constant": 0,
                "description": "Normal polarity."
            },
            {
                "name": "reverse",
                "constant": 1,
                "description": "Reverse polarity."
            }
        ]
    }
}
