{
    "metadata": {
        "SPDX-FileCopyrightText": "Copyright 2024-2026 The BAClib Initiative and Contributors",
        "SPDX-License-Identifier": "EPL-2.0"
    },
    "alias": "DeleteObject-Request",
    "name": "delete-object-request",
    "description": "Request parameters for the DeleteObject service, used to delete a BACnet object from a device.",
    "type": {
        "base": "sequence",
        "fields": [
            {
                "name": "object-identifier",
                "type": "object-identifier",
                "description": "The identifier of the object to be deleted."
            }
        ]
    }
}
