{
    "metadata": {
        "SPDX-FileCopyrightText": "Copyright 2024-2026 The BAClib Initiative and Contributors",
        "SPDX-License-Identifier": "EPL-2.0"
    },
    "alias": "CHOICE",
    "name": "choice",
    "description": "BACnet primitive choice data type for representing a selection from multiple options.",
    "primitive": -2
}
