{
    "metadata": {
        "SPDX-FileCopyrightText": "Copyright 2024-2026 The BAClib Initiative and Contributors",
        "SPDX-License-Identifier": "EPL-2.0"
    },
    "alias": "BACnetLightingTransition",
    "name": "lighting-transition",
    "description": "Represents BACnet Lighting Transition enumeration, which specifies the type of transition effect used when changing lighting levels.",
    "type": {
        "base": "enumerated",
        "values": [
            {
                "name": "none",
                "constant": 0,
                "description": "No lighting transition."
            },
            {
                "name": "fade",
                "constant": 1,
                "description": "Fade transition."
            },
            {
                "name": "ramp",
                "constant": 2,
                "description": "Ramp transition."
            }
        ],
        "maximum": 255,
        "proprietary": {
            "from": 64,
            "to": 255
        }
    }
}
