{
    "metadata": {
        "SPDX-FileCopyrightText": "Copyright 2024-2026 The BAClib Initiative and Contributors",
        "SPDX-License-Identifier": "EPL-2.0"
    },
    "alias": "Unsigned16",
    "name": "unsigned-16",
    "description": "Represents a 16-bit unsigned integer.",
    "type": {
        "base": "unsigned",
        "minimum": 0,
        "maximum": 65535
    }
}
