{
    "metadata": {
        "SPDX-FileCopyrightText": "Copyright 2024-2026 The BAClib Initiative and Contributors",
        "SPDX-License-Identifier": "EPL-2.0"
    },
    "alias": "WriteGroup-Request",
    "name": "write-group-request",
    "description": "Represents a request to write a group of values to a set of BACnet group channels, with optional priority and delay.",
    "type": {
        "base": "sequence",
        "fields": [
            {
                "name": "group-number",
                "type": "unsigned-32",
                "context": 0,
                "description": "The group number identifying the set of channels to write."
            },
            {
                "name": "write-priority",
                "type": {
                    "base": "unsigned",
                    "minimum": 1,
                    "maximum": 16
                },
                "context": 1,
                "description": "The priority to use for the write operation."
            },
            {
                "name": "change-list",
                "type": {
                    "base": "group-channel-value",
                    "series": true
                },
                "context": 2,
                "description": "A list of values to be written to the group channels."
            },
            {
                "name": "inhibit-delay",
                "type": "boolean",
                "context": 3,
                "optional": true,
                "description": "If true, delays the write operation. Optional."
            }
        ]
    }
}
