{
    "metadata": {
        "SPDX-FileCopyrightText": "Copyright 2024-2026 The BAClib Initiative and Contributors",
        "SPDX-License-Identifier": "EPL-2.0"
    },
    "alias": "BACnetProgramRequest",
    "name": "program-request",
    "description": "Enumerates BACnet program requests, specifying actions to be performed on a program object.",
    "type": {
        "base": "enumerated",
        "values": [
            {
                "name": "ready",
                "constant": 0,
                "description": "Program is ready."
            },
            {
                "name": "load",
                "constant": 1,
                "description": "Load program request."
            },
            {
                "name": "run",
                "constant": 2,
                "description": "Run program request."
            },
            {
                "name": "halt",
                "constant": 3,
                "description": "Halt program request."
            },
            {
                "name": "restart",
                "constant": 4,
                "description": "Restart program request."
            },
            {
                "name": "unload",
                "constant": 5,
                "description": "Unload program request."
            }
        ]
    }
}
