{
    "metadata": {
        "SPDX-FileCopyrightText": "Copyright 2024-2026 The BAClib Initiative and Contributors",
        "SPDX-License-Identifier": "EPL-2.0"
    },
    "alias": "BACnetIPMode",
    "name": "ip-mode",
    "description": "Represents BACnet IP Mode enumeration, which specifies the operational mode of a BACnet/IP device in the network.",
    "type": {
        "base": "enumerated",
        "values": [
            {
                "name": "normal",
                "constant": 0,
                "description": "Normal IP mode."
            },
            {
                "name": "foreign",
                "constant": 1,
                "description": "Foreign device IP mode."
            },
            {
                "name": "bbmd",
                "constant": 2,
                "description": "BBMD (BACnet Broadcast Management Device) IP mode."
            }
        ]
    }
}
