{
    "metadata": {
        "SPDX-FileCopyrightText": "Copyright 2024-2026 The BAClib Initiative and Contributors",
        "SPDX-License-Identifier": "EPL-2.0"
    },
    "alias": "AnyPrimitive",
    "name": "any-primitive",
    "description": "A choice of any primitive BACnet data type.",
    "type": {
        "base": "choice",
        "options": [
            {
                "name": "null",
                "type": "null",
                "description": "A null value."
            },
            {
                "name": "boolean",
                "type": "boolean",
                "description": "A boolean value."
            },
            {
                "name": "unsigned",
                "type": "unsigned",
                "description": "An unsigned integer value."
            },
            {
                "name": "integer",
                "type": "integer",
                "description": "A signed integer value."
            },
            {
                "name": "real",
                "type": "real",
                "description": "A real (floating-point) value."
            },
            {
                "name": "double",
                "type": "double",
                "description": "A double-precision floating-point value."
            },
            {
                "name": "octet-string",
                "type": "octet-string",
                "description": "An octet string value."
            },
            {
                "name": "character-string",
                "type": "character-string",
                "description": "A character string value."
            },
            {
                "name": "bit-string",
                "type": "bit-string",
                "description": "A bit string value."
            },
            {
                "name": "enumerated",
                "type": "enumerated",
                "description": "An enumerated value."
            },
            {
                "name": "date-pattern",
                "type": "date-pattern",
                "description": "A date pattern value for matching dates."
            },
            {
                "name": "time-pattern",
                "type": "time-pattern",
                "description": "A time pattern value for matching times."
            },
            {
                "name": "object-identifier",
                "type": "object-identifier",
                "description": "An object identifier value."
            }
        ]
    }
}
