{
    "metadata": {
        "SPDX-FileCopyrightText": "Copyright 2024-2026 The BAClib Initiative and Contributors",
        "SPDX-License-Identifier": "EPL-2.0"
    },
    "alias": "BACnetScale",
    "name": "scale",
    "description": "Represents a BACnet scale, specifying a scaling factor as either a float or integer value.",
    "type": {
        "base": "choice",
        "options": [
            {
                "name": "float-scale",
                "type": "real",
                "context": 0,
                "description": "A floating-point scaling factor."
            },
            {
                "name": "integer-scale",
                "type": "integer",
                "context": 1,
                "description": "An integer scaling factor."
            }
        ]
    }
}
